<?xml version="1.0" encoding="ISO-8859-1"?>
<tool-catalog xmlns:xsi="http://www.w3.org/2001/XMLSchema-instance" xsi:noNamespaceSchemaLocation="tool_catalog.xsd">
 <tool name="lpe2lts" identifier="lpe2lts" location="/some/path/bin/lpe2lts" category="Transform">
  <description>A tool that transforms an LPE to an LTS.</description>
  <object type="input" name="%.lpe" formalism="LPE" default-format="lpe"/>
  <object type="output" name="%.aut" formalism="LTS" default-format="aut">
   <format-selector format="svc">--svc</format-selector>
  </object>
 </tool>
 <tool name="mcrl22lpe" identifier="mcrl22lpe" location="/some/path/bin/mcrl22lpe" category="Transform">
  <description>A tool that transforms mCRL2 specification to an LPE.</description>
  <object type="input" name="%.mcrl2" formalism="mCRL2" default-format="mcrl2"/>
  <object type="output" name="%.lpe" formalism="LPE" default-format="lpe"/>
 </tool>
</tool-catalog>

